label_paper_title,status,research_url,doi,main_cause_cat,secondary_cause_cat,publication_status,working_paper_release_date,topic_subfield,source_main
Randomization in the Tropics Revisited: a Theme and Eleven Variations,deprioritized -- low ratings,https://academic.oup.com/book/31966/chapter/267702059,,Global health; “Health & well-being in low-income countries”,Economic development & governance (LMICs),Working paper/mimeo; not published in a peer-reviewed journal,,"Econometrics,Experimental Design/Experimental economics,Development and Growth",internal-NBER
Global variation in subjective well-being predicts seven forms of altruism. ,01_Needs prioritization/assessor rating,https://www.researchgate.net/profile/Shawn-Rhoads/publication/351196245_Global_variation_in_subjective_well-being_predicts_seven_forms_of_altruism/links/609b49e2a6fdccaebd255046/Global-variation-in-subjective-well-being-predicts-seven-forms-of-altruism.pdf,,"Attitudes and behaviors (Altruism, moral circles, animal consumption, effectiveness, political attitudes, etc.) [Psychology/behavioral economics adjacent group]",,Published: Psychology journal,,,internal-from-syllabus-agenda-policy-database
The animal welfare cost of meat: evidence from a survey of hypothetical scenarios among Belgian consumers,10_seeking_(more)_evaluators,https://lirias.kuleuven.be/3946788?limo=0,,Markets for products with large externalities (focus: animal agriculture),"Attitudes & behaviors (Altruism, moral circles,  effectiveness, political, etc.) [Psych/BE-adjacent ]","published, decent journal ",,,
Structural Uncertainty and the Value of Statistical Life in the Economics of Catastrophic Climate Change,01_Needs prioritization/assessor rating,https://www.nber.org/papers/w13490,,"Catastrophic and existential risks,  the long-term future, forecasting","The Environment: Harm to human health, biodiversity, risks & climate",Working paper/mimeo; not published in a peer-reviewed journal,,Environment/Environment and Resource economics,internal-NBER
Forecasting Existential Risks: Evidence From a Long-Run Forecasting Tournament,"50_published evaluations (on PubPub, by Unjournal)",https://forecastingresearch.org/s/XPT.pdf,,"Catastrophic and existential risks,  the long-term future, forecasting",,Published - CHECK,,,suggested - internally
Generation Next: Experimentation with AI,01_Needs prioritization/assessor rating,https://www.nber.org/papers/w31679,https://doi.org/10.3386/w31679,Emerging technologies: social and economic impacts (focus: AI),,Working paper/mimeo; not published in a peer-reviewed journal,2023-09-01T00:00:00.000-04:00,,
Concentration and Resilience in the US Meat Supply Chains,01_Needs prioritization/assessor rating,https://www.nber.org/papers/w29103,,Markets for products with large externalities (focus: animal agriculture),"Other (Economics): Welfare, growth, policy, global markets & popn.",Working paper/mimeo; not published in a peer-reviewed journal,,"Industrial Organization,Market Structure and Firm Performance,Agriculture/ Ag econ,Covid-19,Environment/Environment and Resource economics",internal-NBER
Pharmaceutical Pricing and R&D as a Global Public Good,01_Needs prioritization/assessor rating,https://elsevier-ssrn-document-store-prod.s3.amazonaws.com/jpube/7d31a8d9-ef88-4d8c-9868-72d58d777f01-meca.pdf?response-content-disposition=inline&X-Amz-Security-Token=IQoJb3JpZ2luX2VjEJ7%2F%2F%2F%2F%2F%2F%2F%2F%2F%2FwEaCXVzLWVhc3QtMSJHMEUCIQDWju%2FjreY1to5hh1dx2j2RhIjHPVGvIBsmKg75YxPHWwIgZcRVdahyU%2FPZV%2FYwmapD6LXz0xdicDgvdeP4tc4a37IqxgUIpv%2F%2F%2F%2F%2F%2F%2F%2F%2F%2FARAEGgwzMDg0NzUzMDEyNTciDEkaZYjk4goUJKl1iSqaBUUVsaw7b%2FwPSFUn0EzPXs%2F4HFzX7zlKRkDcbI9ekeFryAcjmTyQGnSxm2v8T9Eo%2BKnFhlslRAPP4u0QVg3LZ4zF%2Bn1no0AS2nCk4zfFgbImIncPSpHlfpJUX%2BkjW9jlVrDn0ny5DCCO%2B5xZVmsd%2BNj94xF2Y5mARvZFXdypI76JUPszQRd1wfjTooF3el27TGxBPeiyZ87yoTv0oCPl8HiXb5BCTJczJaN2N7WcIgU4EQe48RtWS7sHHrrZpuFlYVM8WpHykV1K9XyNHMhN03DjeRJeCF6jPpCFH5chPJTkj%2B7%2FIN7eHqLWYOlhDTpe2Sg5It2%2FGZxXIFQ%2FrTZMkYViG50igUYUw2g4U4SxGErF1xmXTzdu4BdCeNMIqpMGK9i%2FMn2xJqnd1vfFWE4BDy0TZJuLWgQ%2Fhkd%2Bs6vRbpk46PMyJdRyn%2FQEGUnwAGKiW2MtsB2ax82zv2cHmXqkP1bh6FilsTVuDlIdZVbAdZyXfiJDVDCgYYAvh2A8S3eTsHgwpOjKFQf1AnZemAHZchyFFusm1YN1KpvmLMXiEOvwQmPHz%2BPNmxHMEdEhzCyXTCEQCkfu%2BQEgQNNeINoL4uQV3g4TelhufaK6H2jN9VODEKdp2FjYXT66dPalUfWAEX4A03OFmLZowwJvBQSkXkBoTKIvzjMPVTe2Y%2FFMUhXZ8fpnXlW6trfP9nZdYtm%2F33FnbhQwAdrml7%2Fm7WqsiAT9vsjMdxG3hI1D8RkF0%2BJncFMafiRI5ffwB6p9DqV6MiZqQXdsyHt9Hi2o77VLmq2FeNP3ijRAH%2FvoyviqarrKzY2K24N%2FzN2PbJSX6PaD8IuQhEYRLVbNDd7FN%2FQYHKeym7wMW2Vw9YsvK0SpEh3NWZErmut5lqpokjCqmKK2BjqxAftbjhSpXelbgk%2BWE1Enyqj5btXOi%2BEtQnoQWfSz5JqEvtkyRV37HKxw5ABoPHC4P7aQ4KYdq4leTnWELRcOyEl58T9S9%2BNbFCXfoEEzNaPV6mEDFJXfj4YNshUBw3FOc51hfKY1hbAT69CNkcJG5cG5f9SQ2PepLOCiU%2B1jGQSxz%2B5w8tid1yuhD%2BAFZFV2%2FX%2BR7XUPOqXSjeKY6dr3tUpcBFDhlsL7Zncdl10Q776A5Q%3D%3D&X-Amz-Algorithm=AWS4-HMAC-SHA256&X-Amz-Date=20240823T140817Z&X-Amz-SignedHeaders=host&X-Amz-Expires=300&X-Amz-Credential=ASIAUPUUPRWE5S3ZOO6C%2F20240823%2Fus-east-1%2Fs3%2Faws4_request&X-Amz-Signature=c9b4f638788c50fa0c448b04210cbc278e3d2509611954a6a1809f193bb4715b,,"Other: Economics/welfare, growth, policy, global markets and population","Health & well-being (global, incl. wealthy countries) ,International cooperation & conflict, government behavior,  authoritarianism",Working paper/mimeo; not published in a peer-reviewed journal,,,internal-NBER
Every little helps: exploring meat and animal product consumption in the Tesco 1.0 dataset,02_final consideration needed,https://cabiagbio.biomedcentral.com/articles/10.1186/s43170-023-00178-y,https://doi.org/10.1186/s43170-023-00178-y,Markets for products with large externalities (focus: animal agriculture),,Published - CHECK,,"animal welfare,consumer preferences,Agriculture/ Ag econ,Food Systems/Food Security",submitted (by author(s))
Population ethical intuitions. Cognition.,02_final consideration needed,https://psyarxiv.com/wdbr8/download?format=pdf,,"Attitudes and behaviors (Altruism, moral circles, animal consumption, effectiveness, political attitudes, etc.) [Psychology/behavioral economics adjacent group]",,Published: Psychology journal,,,internal-from-syllabus-agenda-policy-database
A Model of Online Misinformation,"de-prioritized bc. of journal-publication status, authors permission, etc.",https://www.nber.org/system/files/working_papers/w28884/w28884.pdf,,Beliefs and misinformation,,Working paper/mimeo; not published in a peer-reviewed journal,,,internal-NBER
Misinformation During a Pandemic,"de-prioritized bc. of journal-publication status, authors permission, etc.",https://www.nber.org/papers/w27417,,"Health and well-being (global, including wealthy countries)","Communicable diseases, bio-security & pandemic preparedness, biological risks,Catastrophic & existential risks, the long-term future, forecasting,Global health; “Health & well-being in low-income countries”,Beliefs and misinformation","Published, ~top journal",,"Microeconomics,Health, Education, and Welfare,Poverty and Wellbeing,Covid-19",internal-NBER
Egg producer attitudes and expectations regarding the transition to cage-free production: a mixed-methods approach,deprioritized -- low ratings,https://www.sciencedirect.com/science/article/pii/S0032579123005771,,Markets for products with large externalities (focus: animal agriculture),"Attitudes & behaviors (Altruism, moral circles,  effectiveness, political, etc.) [Psych/BE-adjacent ]","Published, ? journal",,animal welfare,suggested - internally
Randomized Regulation: The Impact of Minimum Quality Standards on Health Markets,01_Needs prioritization/assessor rating,https://documents.worldbank.org/en/publication/documents-reports/documentdetail/099512203282320098/idu0932a20f9092e104d0c0a67a02b09390486b1,,Global health; “Health & well-being in low-income countries”,Economic development & governance (LMICs),Working paper/mimeo; not published in a peer-reviewed journal,,,internal-NBER
Carbon Pricing with Regressive Co-benefits: Evidence from British Columbia’s Carbon Tax,deprioritized -- low ratings,https://lorenzosileci.com/assets/pdf/JMP.pdf,,"The Environment: Harm to human health, biodiversity, risks and climate change",,Working paper/mimeo; not published in a peer-reviewed journal,2023-11-01T00:00:00.000-04:00,Environment/Environment and Resource economics,
Stagnation and Scientific Incentives,10_seeking_(more)_evaluators,https://www.nber.org/system/files/working_papers/w26752/w26752.pdf,,"Innovation, meta-science, and research",,Working paper/mimeo; not published in a peer-reviewed journal,,"Health, Education, and Welfare,Development and Growth,Innovation and R&D,Health Policy/Health economics",internal-NBER
The Surrogate Index: Combining Short-Term Proxies to Estimate Long-Term Treatment Effects More Rapidly and Precisely.,02_final consideration needed,https://opportunityinsights.org/wp-content/uploads/2019/11/surrogate_paper.pdf,,"Catastrophic and existential risks,  the long-term future, forecasting","Empirical methods,Global health; “Health & well-being in low-income countries”",Published - CHECK,,Econometrics,internal-from-syllabus-agenda-policy-database
Does online fundraising increase charitable giving? A nationwide field experiment on Facebook,02_final consideration needed,https://bibliothek.wzb.eu/pdf/2024/ii20-302r2.pdf,,"Attitudes and behaviors (Altruism, moral circles, animal consumption, effectiveness, political attitudes, etc.) [Psychology/behavioral economics adjacent group]","Other (Economics): Welfare, growth, policy, global markets & popn.","published, decent journal ",,,suggested - internally
From mostly vegetarian to fully vegetarian: Meat avoidance and the expression of social identity,deprioritized -- low ratings,https://www.sciencedirect.com/science/article/pii/S0950329320302329,,"Attitudes and behaviors (Altruism, moral circles, animal consumption, effectiveness, political attitudes, etc.) [Psychology/behavioral economics adjacent group]",,Published - CHECK,,,suggested - externally - NGO
Does Combating Corruption Reduce Clientelism?,01_Needs prioritization/assessor rating,https://www.nber.org/papers/w31266,,"International cooperation and conflict, behavior of large governments; authoritarianism",Economic development & governance (LMICs),Working paper/mimeo; not published in a peer-reviewed journal,,,internal-NBER
The impact of weather shocks on exports,deprioritized -- low ratings,https://leannecass.com/uploads/LCassJMP.pdf,,"Other: Economics/welfare, growth, policy, global markets and population",,Working paper/mimeo; not published in a peer-reviewed journal,2023-11-01T00:00:00.000-04:00,Environment/Environment and Resource economics,
General equilibrium effects of cash transfers: experimental evidence from Kenya,"de-prioritized bc. of journal-publication status, authors permission, etc.",https://www.givedirectly.org/wp-content/uploads/2019/11/General-Equilibrium-Effects-of-Cash-Transfers.pdf,,Economic development & governance (LMICs),"Other (Economics): Welfare, growth, policy, global markets & popn.","Published, ~top journal",,,suggested - internally
Covid-19 Infection Externalities: Trading Off Lives vs. Livelihoods,01_Needs prioritization/assessor rating,https://www.nber.org/papers/w27009,,"Health and well-being (global, including wealthy countries)",,Working paper/mimeo; not published in a peer-reviewed journal,,"Covid-19,Health, Education, and Welfare,Taxation,Public Economics,Health Policy/Health economics",internal-NBER
"Predicting the moral consideration of artificial intelligences, Janet V.T. Pauketat, Jacy Reese Anthis",deprioritized -- low ratings,https://www.sentienceinstitute.org/downloads/predicting-the-moral-consideration-of-artificial-intelligences.pdf,,"Other: Theory and philosophy, artificial intelligence, natural science, etc.",,"Published, ? journal",,,suggested - internally
Replicability & Generalisability:  A Guide to CEA discounts,"50_published evaluations (on PubPub, by Unjournal)",https://docs.google.com/document/d/1eJBSmNG-iRJ-twoHaoztQUmB4pmEHut8_oT3xgtldnI/edit#heading=h.7om527x8q9t7,,"Other: Economics/welfare, growth, policy, global markets and population","Global health; “Health & well-being in low-income countries”,Economic development & governance (LMICs)",Working paper/mimeo; not published in a peer-reviewed journal,2023-06-21T00:00:00.000-04:00,Research methods,suggested - externally - NGO
ST Proxies for LT Forecasts – Tereick,Not a paper/project,,,Empirical methods,,Unpublished,,,NA
Water Treatment and Child Mortality: Evidence from Kenya,"de-prioritized bc. of journal-publication status, authors permission, etc.",https://bfi.uchicago.edu/wp-content/uploads/2021/10/BFI_WP_2021-118.pdf,,Global health; “Health & well-being in low-income countries”,,Working paper/mimeo; not published in a peer-reviewed journal,,"Health, Education, and Welfare,Development and Growth,Development/Development Economics,Health Policy/Health economics",internal-NBER
Globalization and Pandemics,deprioritized -- low ratings,https://www.nber.org/papers/w27840,,"Communicable diseases, bio-security and pandemic preparedness, biological risks","Catastrophic & existential risks, the long-term future, forecasting",Working paper/mimeo; not published in a peer-reviewed journal,,"International Economics,Globalization and International Relations/Global policy,Health, Education, and Welfare,Covid-19,Health Policy/Health economics",internal-NBER
"Is the Global Economy Deglobalizing? And if so, why? And what is next?",deprioritized -- low ratings,https://www.brookings.edu/articles/is-the-global-economy-deglobalizing-and-if-so-why-and-what-is-next/,,"Other: Economics/welfare, growth, policy, global markets and population",,Published - CHECK,,,internal-NBER
"Uncertainty and Risk-Taking in Science: Meaning, Measurement and Management in Peer Review of Research Proposals (Franzoni and Stephan)",deprioritized -- low ratings,https://www.nber.org/papers/w28562,,"Innovation, meta-science, and research",,Working paper/mimeo; not published in a peer-reviewed journal,,"Development and Growth,Public Economics,Health, Education, and Welfare,Innovation and R&D,Education",internal-NBER
The Basket-Based Choice Experiment: A Method for Food Demand Policy Analysis,01_Needs prioritization/assessor rating,https://www.sciencedirect.com/science/article/abs/pii/S0306919222000343?via%3Dihub,,Markets for products with large externalities (focus: animal agriculture),Empirical methods,Published - CHECK,,,suggested - externally - NGO
Where Have All the “Creative Talents” Gone?,01_Needs prioritization/assessor rating,https://bfi.uchicago.edu/wp-content/uploads/2023/03/BFI_WP_2023-32.pdf,https://doi.org/10.3386/w31085,"Innovation, meta-science, and research","Other (Economics): Welfare, growth, policy, global markets & popn.",Working paper/mimeo; not published in a peer-reviewed journal,2023-03-01T00:00:00.000-05:00,Firm Behavior,
"Money, Time, and Grant Design",02_final consideration needed,https://doi.org/10.48550/arXiv.2312.06479,10.1257/aer.20161574,"Innovation, meta-science, and research","Other (Economics): Welfare, growth, policy, global markets & popn.","Published, ~top journal",,,
Advance Market Commitments: Insights from Theory and Experience,"50_published evaluations (on PubPub, by Unjournal)",https://sites.dartmouth.edu/csnyder/files/2021/02/w26775.pdf,,Global health; “Health & well-being in low-income countries”,"Communicable diseases, bio-security & pandemic preparedness, biological risks","Published, uncertain peer review",2021-02-01T00:00:00.000-05:00,,internal-from-syllabus-agenda-policy-database
Banning wildlife trade can boost demand for unregulated threatened species,"50_published evaluations (on PubPub, by Unjournal)",https://osf.io/preprints/socarxiv/s6gwu/,,Markets for products with large externalities (focus: animal agriculture),"The Environment: Harm to human health, biodiversity, risks & climate",,2022-05-29T00:00:00.000-04:00,,submitted (by author(s))
Does the Squeaky Wheel Get More Grease? The Direct and Indirect Effects of Citizen Participation on Environmental Governance in China,"50_published evaluations (on PubPub, by Unjournal)",https://bfi.uchicago.edu/wp-content/uploads/2022/10/BFI_WP_2022-135.pdf,,"The Environment: Harm to human health, biodiversity, risks and climate change",Economic development & governance (LMICs),Working paper/mimeo; not published in a peer-reviewed journal,2024-08-14T00:00:00.000-04:00,"Other,Law and Economics,Economic Systems,Environment/Environment and Resource economics",suggested - externally
Biodiversity risk,"50_published evaluations (on PubPub, by Unjournal)",https://www.biodiversityrisk.org/,,"The Environment: Harm to human health, biodiversity, risks and climate change","Other (Economics): Welfare, growth, policy, global markets & popn.",Working paper/mimeo; not published in a peer-reviewed journal,,,internal-NBER
Universalism and Political Representation: Evidence from the Field,"de-prioritized bc. of journal-publication status, authors permission, etc.",https://www.nber.org/papers/w31265,,"Attitudes and behaviors (Altruism, moral circles, animal consumption, effectiveness, political attitudes, etc.) [Psychology/behavioral economics adjacent group]",,"published, decent journal ",,Political economy,
Be Cautious with the Precautionary Principle: Evidence from Fukushima Daiichi Nuclear Accident,02_final consideration needed,https://www.nber.org/papers/w26395,,"The Environment: Harm to human health, biodiversity, risks and climate change","Catastrophic & existential risks, the long-term future, forecasting","published, decent journal ",,"Health, Education, and Welfare,Environment/Environment and Resource economics,Health Policy/Health economics",internal-NBER
Building Resilient Health Systems: Experimental Evidence from Sierra Leone and The 2014 Ebola Outbreak,"de-prioritized bc. of journal-publication status, authors permission, etc.",https://web.archive.org/web/20201106080706id_/https://repec.bfi.uchicago.edu/RePEc/pdfs/BFI_WP_202028.pdf,,Global health; “Health & well-being in low-income countries”,,"Published, ~top journal",,,suggested - externally
Adjusting for Publication Bias Reveals Mixed Evidence for the Impact of Cash Transfers on Subjective Well-Being and Mental Health,deprioritized -- low ratings,https://psyarxiv.com/d9vcg/?utm_source=newsletter&utm_medium=email&utm_campaign=the_ea_behavioral_science_newsletter_4&utm_term=2022-03-09,,Global health; “Health & well-being in low-income countries”,Economic development & governance (LMICs),Working paper/mimeo; not published in a peer-reviewed journal,,,suggested - internally
Sacred Values? The Effect of Information on Attitudes toward Payments for Human Organs,"de-prioritized bc. of journal-publication status, authors permission, etc.",https://www.iza.org/publications/dp/10187/efficiency-morality-trade-offs-in-repugnant-transactions-a-choice-experiment,,"Attitudes and behaviors (Altruism, moral circles, animal consumption, effectiveness, political attitudes, etc.) [Psychology/behavioral economics adjacent group]",,"Published, ~top journal",,"Microeconomics,Econometrics,Experimental Design/Experimental economics,Market Structure and Firm Performance,Welfare and collective choice,Health, Education, and Welfare,Health Policy/Health economics",internal-NBER
Subjecting the ‘Average Joe’ to War Theatre Triggers Intimate Partner Violence,deprioritized -- low ratings,https://www.nber.org/papers/w31227,,Global health; “Health & well-being in low-income countries”,,Working paper/mimeo; not published in a peer-reviewed journal,,,internal-NBER
Towards best practices in AGI safety and governance,04_selected_choose_evaluation_manager,https://arxiv.org/abs/2305.07153,https://doi.org/10.48550/arXiv.2305.07153,Emerging technologies: social and economic impacts (focus: AI),"Catastrophic & existential risks, the long-term future, forecasting",Working paper/mimeo; not published in a peer-reviewed journal,2023-05-11T00:00:00.000-04:00,AI Alignment,
Global Supply Chains in the Pandemic,02_final consideration needed,https://www.nber.org/papers/w27224,,"Other: Economics/welfare, growth, policy, global markets and population","Catastrophic & existential risks, the long-term future, forecasting","published, decent journal ",,"Covid-19,International Economics",internal-NBER
"When will AI exceed human performance? Evidence from AI experts"" (FHI linked)",deprioritized -- low ratings,https://arxiv.org/abs/1705.08807,,Emerging technologies: social and economic impacts (focus: AI),"Other: Theory and philosophy, artificial intelligence, natural science, etc.","Published, ? journal",,,internal-from-syllabus-agenda-policy-database
Accelerating Vaccine Innovation for Emerging Infectious Diseases via Parallel Discovery,"50_published evaluations (on PubPub, by Unjournal)",https://www.nber.org/papers/w30126,,"Catastrophic and existential risks,  the long-term future, forecasting","Innovation, meta-science, & research",book chapter,2022-06-21T00:00:00.000-04:00,"Covid-19,Public Economics,National Fiscal Issues,Health, Education, and Welfare,Health Policy/Health economics",internal-NBER
2017 Report on Consciousness and Moral Patienthood,deprioritized -- low ratings,https://www.openphilanthropy.org/research/2017-report-on-consciousness-and-moral-patienthood/,,"Other: Theory and philosophy, artificial intelligence, natural science, etc.",,Published - CHECK,,,suggested - externally - NGO
Existential risk and growth,"50_published evaluations (on PubPub, by Unjournal)",comm,,"Catastrophic and existential risks,  the long-term future, forecasting","Other (Economics): Welfare, growth, policy, global markets & popn.",Working paper/mimeo; not published in a peer-reviewed journal,,,internal-from-syllabus-agenda-policy-database
The Impact of Corporate Social Responsibility on Animal Welfare Standards: Evidence from the Cage-free Egg Industry,authors rejected/blocked us,https://papers.ssrn.com/sol3/papers.cfm?abstract_id=4219976,,Markets for products with large externalities (focus: animal agriculture),,Published - CHECK,,animal welfare,suggested - internally
"The causal effect of environmental catastrophe on long-run economic growth: Evidence from 6,700 cyclones",deprioritized -- low ratings,https://gspp.berkeley.edu/research-and-impact/working-papers/the-causal-effect-of-environmental-catastrophe-on-long-run-economic-growth,,"The Environment: Harm to human health, biodiversity, risks and climate change","Other (Economics): Welfare, growth, policy, global markets & popn.,Innovation, meta-science, & research,Economic development & governance (LMICs)",Working paper/mimeo; not published in a peer-reviewed journal,,"Public Economics,Development and Growth,Development/Development Economics,Environment/Environment and Resource economics,Regional and Urban Economics,Policy",internal-NBER
Long term cost-effectiveness of resilient foods for global catastrophes compared to artificial general intelligence safety,"50_published evaluations (on PubPub, by Unjournal)",https://allfed.info/images/pdfs/Long_term_cost_effectiveness_of_resilien.pdf,,"Catastrophic and existential risks,  the long-term future, forecasting",Emerging technologies: social & economic impacts (focus: AI),"Published, ? journal",2022-04-21T00:00:00.000-04:00,,submitted (by author(s))
Intergenerational Child Mortality Impacts of Deworming: Experimental Evidence from Two Decades of the Kenya Life Panel Survey,"50_published evaluations (on PubPub, by Unjournal)",https://escholarship.org/uc/item/3d11905j,,Global health; “Health & well-being in low-income countries”,,Working paper/mimeo; not published in a peer-reviewed journal,,"Development and Growth,Global Health/ interventions",internal-NBER
Cognitive Behavioral Therapy among Ghana’s Rural Poor Is Effective Regardless of Baseline Mental Distress,"50_published evaluations (on PubPub, by Unjournal)",https://www.aeaweb.org/articles?id=10.1257/aeri.20210612,,Global health; “Health & well-being in low-income countries”,Economic development & governance (LMICs),,2022-12-01T00:00:00.000-05:00,"Public Economics,Health, Education, and Welfare,Poverty and Wellbeing,Labor Economics,Demography and Aging,Labor Supply and Demand,Development and Growth,Development/Development Economics",internal-NBER
"Consumer preferences for farm-raised meat, lab-grown meat, and plant-based meat alternatives: Does information or brand matter? (Food Policy)",deprioritized -- low ratings,https://edepot.wur.nl/530803,,Markets for products with large externalities (focus: animal agriculture),"Attitudes & behaviors (Altruism, moral circles,  effectiveness, political, etc.) [Psych/BE-adjacent ]","Published, ? journal",,,suggested - internally
Universal Basic Income: Short-Term Results from a Long-Term Experiment in Kenya,"50_published evaluations (on PubPub, by Unjournal)",https://conference.nber.org/conf_papers/f192616.pdf,,Economic development & governance (LMICs),"Other (Economics): Welfare, growth, policy, global markets & popn.",Working paper/mimeo; not published in a peer-reviewed journal,2023-09-15T00:00:00.000-04:00,cash grants,
Traditional Institutions in Modern Times: Dowries as Pensions When Sons Migrate,deprioritized -- low ratings,https://www.nber.org/papers/w31176,,Economic development & governance (LMICs),"Other (Economics): Welfare, growth, policy, global markets & popn.",Working paper/mimeo; not published in a peer-reviewed journal,,,internal-NBER
