label_paper_title,status,research_url,doi,main_cause_cat,secondary_cause_cat,publication_status,working_paper_release_date,topic_subfield,source_main
Artificial Intelligence and the Modern Productivity Paradox: A Clash of Expectations and Statistics,deprioritized -- low ratings,https://www.nber.org/papers/w24001,,Emerging technologies: social and economic impacts (focus: AI),"Other (Economics): Welfare, growth, policy, global markets & popn.",Working paper/mimeo; not published in a peer-reviewed journal,,"Development and Growth,Microeconomics,Innovation and R&D,Policy",internal-NBER
A synthesis of evidence for policy from behavioural science during COVID-19,deprioritized -- low ratings,https://www.nature.com/articles/s41586-023-06840-9,,"Innovation, meta-science, and research","Communicable diseases, bio-security & pandemic preparedness, biological risks","Published, ~top journal",,"Attitudes and behaviors (Altruism, moral circles, animal consumption, effectiveness, political attitudes, etc.),attitudes/behavioral",
Laboratory Safety and Research Productivity,02_final consideration needed,https://www.hbs.edu/ris/Publication%20Files/22-072_fcb4ee52-5af5-4c82-976a-dd47cf054218.pdf,,"Innovation, meta-science, and research","Catastrophic & existential risks, the long-term future, forecasting","Published, uncertain peer review",,,internal-NBER
The Governance Of Non-Profits And Their Social Impact: Evidence From A Randomized Program In Healthcare In DRC,"50_published evaluations (on PubPub, by Unjournal)",https://www.nber.org/system/files/working_papers/w30391/w30391.pdf,,Global health; “Health & well-being in low-income countries”,Economic development & governance (LMICs),Working paper/mimeo; not published in a peer-reviewed journal,2022-08-29T00:00:00.000-04:00,"Health, Education, and Welfare,Education,Development and Growth,Development/Development Economics,Health Policy/Health economics",internal-NBER
Happiness for the whole family,03_awaiting authors' consent (where needed) or imminent update,https://www.happierlivesinstitute.org/report/happiness-for-the-whole-family/,,Economic development & governance (LMICs),"Other (Economics): Welfare, growth, policy, global markets & popn.,Attitudes & behaviors (Altruism, moral circles,  effectiveness, political, etc.) [Psych/BE-adjacent ]",Working paper/mimeo; not published in a peer-reviewed journal,,,suggested - externally
Effects of Emigration on Rural Labor Markets,"50_published evaluations (on PubPub, by Unjournal)","https://www.nber.org/papers/w23929#:~:text=Emigration%20could%20benefit%20landless%20village,productivity%20if%20skilled%20workers%20leave",,Economic development & governance (LMICs),"Other (Economics): Welfare, growth, policy, global markets & popn.",Working paper/mimeo; not published in a peer-reviewed journal,,"Development/Development Economics,Development and Growth,Regional and Urban Economics,Migration",internal-NBER
"International AI Institutions: A Literature Review of Models, Examples, and Proposals",deprioritized -- low ratings,https://papers.ssrn.com/sol3/papers.cfm?abstract_id=4579773,,"Catastrophic and existential risks,  the long-term future, forecasting",,Published - CHECK,,,suggested - internally
"Policies, Projections, and the Social Cost of Carbon: Results from the DICE-2023 Model",deprioritized -- low ratings,https://www.nber.org/papers/w31112,,"The Environment: Harm to human health, biodiversity, risks and climate change",,"Published, ~top journal",,,internal-NBER
Water Treatment and Child Mortality: A Meta-analysis and Cost-effectiveness Analysis,"50_published evaluations (on PubPub, by Unjournal)",https://bfi.uchicago.edu/wp-content/uploads/2023/01/BFI_WP_2022-26-2.pdf,,Global health; “Health & well-being in low-income countries”,,Working paper/mimeo; not published in a peer-reviewed journal,,Health Policy/Health economics,suggested - externally - NGO
Cognitive behavior therapy reduces crime and violence over 10 years: Experimental evidence,02_final consideration needed,https://osf.io/preprints/socarxiv/q85ux/,,Economic development & governance (LMICs),Economic development & governance (LMICs),Published - CHECK,,,suggested - internally
Serendipity in Science,deprioritized -- low ratings,https://arxiv.org/abs/2308.07519,https://doi.org/10.48550/arXiv.2308.07519,"Innovation, meta-science, and research",,Working paper/mimeo; not published in a peer-reviewed journal,2023-08-15T00:00:00.000-04:00,Metascience,
Incentives and Creativity: Evidence from the Academic Life Sciences,02_final consideration needed,https://www.nber.org/papers/w15466,,"Innovation, meta-science, and research",,"published, decent journal ",,"Development and Growth,Innovation and R&D",internal-NBER
The Comparative Impact of Cash Transfers and a Psychotherapy Program on Psychological and Economic Well-being,"50_published evaluations (on PubPub, by Unjournal)",https://www.nber.org/papers/w28106,,Global health; “Health & well-being in low-income countries”,Economic development & governance (LMICs),Working paper/mimeo; not published in a peer-reviewed journal,2020-11-21T00:00:00.000-05:00,"Econometrics,Experimental Design/Experimental economics,Microeconomics,Behavioral Economics,Development and Growth,Development/Development Economics",internal-NBER
"Artificial intelligence, globalization, and strategies for economic development",deprioritized -- low ratings,https://www.nber.org/papers/w28453,,Emerging technologies: social and economic impacts (focus: AI),Economic development & governance (LMICs),Working paper/mimeo; not published in a peer-reviewed journal,,"International Economics,Globalization and International Relations/Global policy,Development and Growth,Innovation and R&D",internal-NBER
Cash Can Make Its Absence Felt: Randomizing Unconditional Cash Transfer Amounts in the US,20_awaiting_evaluations,https://papers.ssrn.com/sol3/papers.cfm?abstract_id=4154000,,"Other: Economics/welfare, growth, policy, global markets and population",,Working paper/mimeo; not published in a peer-reviewed journal,2022-12-19T00:00:00.000-05:00,,suggested - externally
Losing target: Randomized environmental inspections and law enforcement efficiency,"de-prioritized bc. of journal-publication status, authors permission, etc.",,,"The Environment: Harm to human health, biodiversity, risks and climate change",,,2024-06-24T00:00:00.000-04:00,"Environment/Environment and Resource economics,Policy",submitted (by author(s))
When do “Nudges” Increase Welfare?,"50_published evaluations (on PubPub, by Unjournal)",https://www.nber.org/papers/w30740,,"Other: Economics/welfare, growth, policy, global markets and population","Attitudes & behaviors (Altruism, moral circles,  effectiveness, political, etc.) [Psych/BE-adjacent ],Other (Economics): Welfare, growth, policy, global markets & popn.",Working paper/mimeo; not published in a peer-reviewed journal,2022-12-12T00:00:00.000-05:00,"Attitudes and behaviors (Altruism, moral circles, animal consumption, effectiveness, political attitudes, etc.)",
"Merit, Inequality, and Opportunity: The Impact of Malawi’s Secondary Schools",deprioritized -- low ratings,https://www.cgdev.org/sites/default/files/merit-inequality-and-opportunity-impact-malawis-selective-secondary-schools.pdf,,Economic development & governance (LMICs),,Working paper/mimeo; not published in a peer-reviewed journal,,,
"Global Risk, Non-Bank Financial Intermediation, and Emerging Market Vulnerabilities",01_Needs prioritization/assessor rating,https://www.annualreviews.org/content/journals/10.1146/annurev-economics-082222-074901,,"Other: Economics/welfare, growth, policy, global markets and population",Economic development & governance (LMICs),"published, decent journal ",,,internal-NBER
Long-term cost-effectiveness of interventions for loss of electricity/industry compared to artificial general intelligence safety,deprioritized -- low ratings,https://eujournalfuturesresearch.springeropen.com/articles/10.1186/s40309-021-00178-z,,Emerging technologies: social and economic impacts (focus: AI),,"Published, ? journal",,,submitted (by author(s))
The Benefits and Costs of Guest Worker Programs: Experimental Evidence From the India-UAE Migration Corridor,"50_published evaluations (on PubPub, by Unjournal)",https://www.nber.org/papers/w31354,,Economic development & governance (LMICs),,Working paper/mimeo; not published in a peer-reviewed journal,2023-06-19T00:00:00.000-04:00,"Labor Economics,Migration",internal-NBER
Health Knowledge and Non-Pharmaceutical Interventions During the COVID-19 Pandemic in Africa,01_Needs prioritization/assessor rating,https://www.nber.org/papers/w28316,,Global health; “Health & well-being in low-income countries”,"Catastrophic & existential risks, the long-term future, forecasting","published, decent journal ",,"Health, Education, and Welfare,Development/Development Economics,Development and Growth,Covid-19,Health Policy/Health economics",internal-NBER
Longer-run Economic Consequences of Pandemics,01_Needs prioritization/assessor rating,https://www.nber.org/papers/w26934,,"Catastrophic and existential risks,  the long-term future, forecasting","Other (Economics): Welfare, growth, policy, global markets & popn.","Published, ~top journal",,"International Economics,Covid-19",internal-NBER
The Environmental Effects of Economic Production: Evidence from Ecological Observations,"50_published evaluations (on PubPub, by Unjournal)",10,,Economic development & governance (LMICs),"The Environment: Harm to human health, biodiversity, risks & climate",Working paper/mimeo; not published in a peer-reviewed journal,2021-10-11T00:00:00.000-04:00,"Development and Growth,Renewable Resources,Environment/Environment and Resource economics,Policy",internal-NBER
"Top Talent, Elite Colleges, and Migration: Evidence from the Indian Institutes of Technology",01_Needs prioritization/assessor rating,https://www.nber.org/papers/w31308,,"Other: Economics/welfare, growth, policy, global markets and population",Economic development & governance (LMICs),"published, decent journal ",,Migration,internal-NBER
Building Resilient Education Systems: Evidence from Large-Scale Randomized Trials in Five Countries,30_contacting/awaiting_authors_response_to_evaluation,https://static1.squarespace.com/static/60d0c05ace34212ef5a1131b/t/645a72201a2a280635acb739/1683649057454/Angrist_Ainomugisha_Bathena_Bergman_et-al_Building-Resilient-Education-Systems_2023.pdf,,Economic development & governance (LMICs),Global health; “Health & well-being in low-income countries”,Working paper/mimeo; not published in a peer-reviewed journal,,,internal-NBER
"Forced Displacement, Mental Health, and Child Development: Evidence from the Rohingya Refugees",authors rejected/blocked us,https://www.povertyactionlab.org/sites/default/files/research-paper/wp9686_Forced-Displacement-Mental-Health-Rohingya-Refugees_Oct2022.pdf,,Global health; “Health & well-being in low-income countries”,"Attitudes & behaviors (Altruism, moral circles,  effectiveness, political, etc.) [Psych/BE-adjacent ]",book chapter,,"Global Health/ interventions,Mental Health Interventions",suggested - externally - NGO
Dust pollution from the Sahara and African infant mortality,01_Needs prioritization/assessor rating,https://web.stanford.edu/~mburke/papers/heftneal_et_al_dust_2020.pdf,,Global health; “Health & well-being in low-income countries”,,"published, decent journal ",,"Development and Growth,Development/Development Economics,Environment/Environment and Resource economics",internal-NBER
Draft report on AI timelines,deprioritized -- low ratings,https://www.lesswrong.com/posts/KrJfoZzpSDpnrv9va/draft-report-on-ai-timelines,,"Catastrophic and existential risks,  the long-term future, forecasting",,Working paper/mimeo; not published in a peer-reviewed journal,,,suggested - externally - NGO
Generative AI at Work,deprioritized -- low ratings,https://www.nber.org/system/files/working_papers/w31161/w31161.pdf,,Emerging technologies: social and economic impacts (focus: AI),"Other (Economics): Welfare, growth, policy, global markets & popn.",Published - CHECK,,,internal-NBER
The Elasticity of Science,02_final consideration needed,https://www.kylemyers.org/_files/ugd/73b908_0a793223c0a644bc8ce519636abdc456.pdf,https://www.kylemyers.org/_files/ugd/73b908_0a793223c0a644bc8ce519636abdc456.pdf,"Innovation, meta-science, and research",,"Published, ~top journal",,,
Choose Your Moments: Peer Review and Scientific Risk Taking,04_selected_choose_evaluation_manager,https://www.nber.org/system/files/working_papers/w31409/w31409.pdf,,"Innovation, meta-science, and research",,Working paper/mimeo; not published in a peer-reviewed journal,,,
The Wandering Scholars: Understanding the Heterogeneity of University Commercialization,02_final consideration needed,https://www.hbs.edu/faculty/Pages/item.aspx?num=65320,https://doi.org/10.3386/w32069,"Innovation, meta-science, and research",,Working paper/mimeo; not published in a peer-reviewed journal,2024-01-18T00:00:00.000-05:00,"Metascience,Innovation and R&D,the economics of science and innovation",
Animals and Social Welfare,02_final consideration needed,https://papers.ssrn.com/sol3/papers.cfm?abstract_id=4113271,,Markets for products with large externalities (focus: animal agriculture),"Other (Economics): Welfare, growth, policy, global markets & popn.","published, decent journal ",2024-04-23T00:00:00.000-04:00,"animal welfare,Agriculture/ Ag econ",
Behavioral Evidence for Global Consciousness Transcending National Parochialism,01_Needs prioritization/assessor rating,https://www.researchgate.net/publication/370908621_Behavioral_Evidence_for_Global_Consciousness_Transcending_National_Parochialism,,"Attitudes and behaviors (Altruism, moral circles, animal consumption, effectiveness, political attitudes, etc.) [Psychology/behavioral economics adjacent group]",,Working paper/mimeo; not published in a peer-reviewed journal,,,
Giving farm animals a name and a face: Eliciting animal advocacy among omnivores using the identifiable victim effect,01_Needs prioritization/assessor rating,https://osf.io/preprints/psyarxiv/ybpm4,,"Attitudes and behaviors (Altruism, moral circles, animal consumption, effectiveness, political attitudes, etc.) [Psychology/behavioral economics adjacent group]",,Published: Psychology journal,,,
"Ends versus Means: Kantians, Utilitarians, and Moral Decisions",02_final consideration needed,https://luca-henkel.github.io/papers/Moral_Ends_Means.pdf,https://doi.org/10.3386/w32073,"Other: Theory and philosophy, artificial intelligence, natural science, etc.","Attitudes & behaviors (Altruism, moral circles,  effectiveness, political, etc.) [Psych/BE-adjacent ]",Working paper/mimeo; not published in a peer-reviewed journal,2024-01-29T00:00:00.000-05:00,"Attitudes and behaviors (Altruism, moral circles, animal consumption, effectiveness, political attitudes, etc.)",
Digital Information Provision and Behavior Change: Lessons from Six Experiments in East Africa,02_final consideration needed,https://www.nber.org/papers/w32048#fromrss,10.3386/w32048,Economic development & governance (LMICs),,Working paper/mimeo; not published in a peer-reviewed journal,2024-01-01T00:00:00.000-05:00,"Development and Growth,Agriculture/ Ag econ",
"A Framework for Economic Growth with Capital-Embodied Technical Change
",02_final consideration needed,https://www.nber.org/papers/w30459,,"Other: Economics/welfare, growth, policy, global markets and population",,Working paper/mimeo; not published in a peer-reviewed journal,,,
Long-term effects of lead,deprioritized -- low ratings,https://www.nber.org/papers/w31957,https://doi.org/10.3386/w31957,Global health; “Health & well-being in low-income countries”,,Working paper/mimeo; not published in a peer-reviewed journal,2023-12-01T00:00:00.000-05:00,Health Policy/Health economics,
Copyright Policy Options for Generative Artificial Intelligence,When Product Markets Become Collective Traps: The Case of Social Media,https://www.nber.org/papers/w32106,https://doi.org/10.3386/w32106,Emerging technologies: social and economic impacts (focus: AI),,Working paper/mimeo; not published in a peer-reviewed journal,2024-02-05T00:00:00.000-05:00,,
How Learning About Harms Impacts the Optimal Rate of Artificial Intelligence Adoption,When Product Markets Become Collective Traps: The Case of Social Media,https://www.nber.org/papers/w32105?utm_campaign=ntwh&utm_medium=email&utm_source=ntwg2,https://doi.org/10.3386/w32105,"Catastrophic and existential risks,  the long-term future, forecasting","Other (Economics): Welfare, growth, policy, global markets & popn.",Working paper/mimeo; not published in a peer-reviewed journal,2024-02-05T00:00:00.000-05:00,,
Urban Forests: Environmental Health Values and Risks,02_final consideration needed,https://static1.squarespace.com/static/56034c20e4b047f1e0c1bfca/t/64cc6e2433011927e704dd75/1691119145031/XHXXZ_urbanforest_2023-8-3.pdf,doi.org/10.3386/w31554,"The Environment: Harm to human health, biodiversity, risks and climate change",,Working paper/mimeo; not published in a peer-reviewed journal,2023-08-01T00:00:00.000-04:00,Environment/Environment and Resource economics,
What drives poor quality of care for child diarrhea?,deprioritized - no open access version,,doi.org/10.1126/science.adj9986,Global health; “Health & well-being in low-income countries”,,"Published, ~top journal",2024-02-09T00:00:00.000-05:00,Global Health/ interventions,
AI-Augmented Predictions: LLM Assistants Improve Human Forecasting Accuracy,01_Needs prioritization/assessor rating,https://arxiv.org/abs/2402.07862,https://doi.org/10.48550/arXiv.2402.07862,Emerging technologies: social and economic impacts (focus: AI),,Working paper/mimeo; not published in a peer-reviewed journal,,,
Effective and Scalable Math Support: Evidence on the Impact of an AITutor on Math Achievement in Ghana,When Product Markets Become Collective Traps: The Case of Social Media,https://arxiv.org/ftp/arxiv/papers/2402/2402.09809.pdf,,Emerging technologies: social and economic impacts (focus: AI),,Published - CHECK,,,
Robots For Economic Development,02_final consideration needed,https://www.econstor.eu/handle/10419/249581,,Emerging technologies: social and economic impacts (focus: AI),"Other (Economics): Welfare, growth, policy, global markets & popn.",Working paper/mimeo; not published in a peer-reviewed journal,2022-02-01T00:00:00.000-05:00,"Labor Economics,economic growth",suggested - internally
Moral expansiveness around the world: The role of societal factors across 36 countries,01_Needs prioritization/assessor rating,https://psyarxiv.com/2x6nv/,,"Attitudes and behaviors (Altruism, moral circles, animal consumption, effectiveness, political attitudes, etc.) [Psychology/behavioral economics adjacent group]","Attitudes & behaviors (Altruism, moral circles,  effectiveness, political, etc.) [Psych/BE-adjacent ]",Published: Psychology journal,,,
Humans First: Why people value animals less than humans,deprioritized -- low ratings,http://files.luciuscaviola.com/Caviola-et-al_2022_Humans_first.pdf,,"Attitudes and behaviors (Altruism, moral circles, animal consumption, effectiveness, political attitudes, etc.) [Psychology/behavioral economics adjacent group]",Markets for products with large externalities (focus: animal agriculture),Published: Psychology journal,,,suggested - internally
National parochialism is ubiquitous across 42 nations around the world. Nature Communications. ,01_Needs prioritization/assessor rating,https://www.nature.com/articles/s41467-021-24787-1,,"Attitudes and behaviors (Altruism, moral circles, animal consumption, effectiveness, political attitudes, etc.) [Psychology/behavioral economics adjacent group]",,Published - CHECK,,,internal-from-syllabus-agenda-policy-database
"Empathy, Motivated Reasoning, and Redistribution",02_final consideration needed,https://web.stanford.edu/~tingyan/files/Empathy_JMP.pdf,,"Attitudes and behaviors (Altruism, moral circles, animal consumption, effectiveness, political attitudes, etc.) [Psychology/behavioral economics adjacent group]","Other (Economics): Welfare, growth, policy, global markets & popn.",Unpublished,,,submitted (by author(s))
"Catastrophic climate change, population ethics and intergenerational equity",02_final consideration needed,https://ethz.ch/content/dam/ethz/special-interest/mtec/cer-eth/resource-econ-dam/documents/research/sured/sured-2018/58-MEJEAN%20et%20al%20SURED.pdf,,"Other: Economics/welfare, growth, policy, global markets and population","The Environment: Harm to human health, biodiversity, risks & climate","Published, ? journal",,,internal-from-syllabus-agenda-policy-database
Consumer preferences for cage-free eggs and impacts of retailer pledges,02_final consideration needed,https://onlinelibrary.wiley.com/doi/epdf/10.1002/agr.21580,,Markets for products with large externalities (focus: animal agriculture),"Attitudes & behaviors (Altruism, moral circles,  effectiveness, political, etc.) [Psych/BE-adjacent ],Possible category: more ‘economics’ treatment of preferences for giving and ‘ethical/donation-linked’ choices; implications of these preferences; donor coordination etc.","Published, ? journal",,,suggested - internally
Who Stands on the Shoulders of Chinese (Scientific) Giants? Evidence from Chemistry,01_Needs prioritization/assessor rating,https://www.nber.org/papers/w30772,https://doi.org/10.3386/w30772,"Innovation, meta-science, and research",,Working paper/mimeo; not published in a peer-reviewed journal,2023-07-01T00:00:00.000-04:00,Metascience,
"Barriers to Education Technology Tools Faced by Educators in Pakistan, with a Focus on Mobile Internet Connectivity",deprioritized - no open access version,,,Economic development & governance (LMICs),,,,,submitted (by author(s))
Informing Mothers about the Benefits of Conversing with Infants: Experimental Evidence from Ghana,01_Needs prioritization/assessor rating,https://seemajayachandran.com/infant_directed_speech.pdf,,Global health; “Health & well-being in low-income countries”,,Published - CHECK,,,internal-NBER
Germs in the Family: The Long-Term Consequences of Intra-Household Endemic Respiratory Disease Spread,01_Needs prioritization/assessor rating,https://www.ipr.northwestern.edu/documents/working-papers/2021/wp-21-53.pdf,,"Health and well-being (global, including wealthy countries)","Communicable diseases, bio-security & pandemic preparedness, biological risks",Working paper/mimeo; not published in a peer-reviewed journal,,"Health, Education, and Welfare,Health Policy/Health economics,Infectious Disease Modelling,epidemiology",internal-NBER
Persistence: A critical review,01_Needs prioritization/assessor rating,https://docs.google.com/document/d/14ULAaTofWiQbTCP1ekuaenQJ6saXEzjgiKMznIBrXvQ/edit,,"Catastrophic and existential risks,  the long-term future, forecasting",Empirical methods,Unpublished,,meta-analysis,suggested - externally
Understanding the Impacts of a Natural Disaster: Evidence from the 2004 Indian Ocean Tsunami,01_Needs prioritization/assessor rating,https://www.nber.org/papers/w31132,,"Catastrophic and existential risks,  the long-term future, forecasting",Economic development & governance (LMICs),Working paper/mimeo; not published in a peer-reviewed journal,,,internal-NBER
Harms of AI,01_Needs prioritization/assessor rating,https://economics.mit.edu/sites/default/files/publications/Harms%20of%20AI.pdf,,Emerging technologies: social and economic impacts (focus: AI),"Other (Economics): Welfare, growth, policy, global markets & popn.",Working paper/mimeo; not published in a peer-reviewed journal,,"Development and Growth,Innovation and R&D,Economic Systems,Industrial Organization",internal-NBER
"Reducing Bias Among Health Care Providers: Experimental Evidence From Tanzania, Burkina Faso, and Pakistan",01_Needs prioritization/assessor rating,https://www.nber.org/papers/w31269,,Global health; “Health & well-being in low-income countries”,Economic development & governance (LMICs),,,,internal-NBER
What happens when the machines stop? [FLAG: internal author],deprioritized -- out of scope or other subjective judgment,https://doi.org/10.31235/osf.io/2vctm,,"Catastrophic and existential risks,  the long-term future, forecasting",,Working paper/mimeo; not published in a peer-reviewed journal,,,submitted (by author(s))
"The Missing Middle Managers: Labor Costs, Firm Structure, and Development",deprioritized -- low ratings,https://www.nber.org/papers/w30592,,Economic development & governance (LMICs),,Working paper/mimeo; not published in a peer-reviewed journal,,"Development and Growth,Policy",internal-NBER
The Impact of Group Size on Giving Versus Demand for Redistribution [renamed],01_Needs prioritization/assessor rating,https://www.nber.org/papers/w29375,,"Attitudes and behaviors (Altruism, moral circles, animal consumption, effectiveness, political attitudes, etc.) [Psychology/behavioral economics adjacent group]",Possible category: more ‘economics’ treatment of preferences for giving and ‘ethical/donation-linked’ choices; implications of these preferences; donor coordination etc.,Working paper/mimeo; not published in a peer-reviewed journal,,"Health, Education, and Welfare,Poverty and Wellbeing",internal-NBER
Uncertainty and Individual Discretion in Allocating Research Funds,02_final consideration needed,https://www.nber.org/papers/w32033,,"Innovation, meta-science, and research",,Working paper/mimeo; not published in a peer-reviewed journal,,,
Surplus Appropriation from R&D and Health Care Technology Assessment Procedures,01_Needs prioritization/assessor rating,https://www.nber.org/papers/w12016,,"Health and well-being (global, including wealthy countries)","Innovation, meta-science, & research",Working paper/mimeo; not published in a peer-reviewed journal,,"Health, Education, and Welfare,Health Policy/Health economics",internal-NBER
