label_paper_title,status,research_url,doi,main_cause_cat,secondary_cause_cat,publication_status,working_paper_release_date,topic_subfield,source_main
All Crises Are Unhappy in Their Own Way: The Role of Societal Instability in Shaping the Past,,https://doi.org/10.31235/osf.io/rk4gd,,,,,,,
"Social resilience to nuclear winter: lessons from the Late Antique Little Ice Age
",,https://www.tandfonline.com/doi/full/10.1080/23779497.2021.1963808#abstract,,"Catastrophic and existential risks,  the long-term future, forecasting",,Published in a journal (unsure about the journal positioning) ,,,
"Climate Endgame: Exploring catastrophic climate change scenarios
",,https://www.pnas.org/doi/10.1073/pnas.2108146119#sec-2,,"The Environment: Harm to human health, biodiversity, risks and climate change",,Published in a top journal,,GCRs,
All Crises are Unhappy in their Own Way: The role of societal instability in shaping the past,,https://osf.io/preprints/socarxiv/rk4gdhttps://osf.io/preprints/socarxiv/rk4gd,,"Catastrophic and existential risks,  the long-term future, forecasting",,"Working paper/mimeo, not published",,,
Misperceptions and Demand for Democracy under Authoritarianism,,https://www.nber.org/papers/w33018?utm_campaign=ntwh&utm_medium=email&utm_source=ntwg30,10.3386/w33018,"International cooperation and conflict, behavior of large governments; authoritarianism",,"Working paper/mimeo, not published",,Government accountability & misinformation,
The Effects of Firms' Lobbying on Resource Misallocation,,http://web.mit.edu/insong/www/pdf/misallocation.pdf,,"Other: Economics/welfare, growth, policy, global markets and population",,"Working paper/mimeo, not published",,Political economy,
A survey on inter-animal welfare comparisons,,https://docs.google.com/document/d/1n25m8kQgML-1k-jVVPG_cG275fTgYyl82umpIBM8JOg/edit,,"Attitudes and behaviors (Altruism, moral circles, animal consumption, effectiveness, political attitudes, etc.) [Psychology/behavioral economics adjacent group]",,"Working paper/mimeo, not published",,stijn.bruers@gmail.com,
The Impact of PhD Studies on Mental Health—A Longitudinal Population Study,,https://lucris.lub.lu.se/ws/portalfiles/portal/194583123/WP24_5,,"Innovation, meta-science, and research",,Working paper/mimeo; not published in a peer-reviewed journal,,,
Forest Protection and Human Health: The Case of Malaria in the Brazilian Amazon,01_Needs prioritization/assessor rating,https://ideas.repec.org/p/spa/wpaper/2023wpecon8.html,,Global health; “Health & well-being in low-income countries”,,Working paper/mimeo; not published in a peer-reviewed journal,,,
Separable Social Welfare Evaluation for Multi-Species Populations,02_final consideration needed,https://budolfson.github.io/files/ZuberSpearsBudolfsonAnimalsSeparability.pdf,,Markets for products with large externalities (focus: animal agriculture),"Other (Economics): Welfare, growth, policy, global markets & popn.",Working paper/mimeo; not published in a peer-reviewed journal,,,suggested - internally
"A Welfare Analysis of Policies
Impacting Climate Change",,https://policyimpacts.org/wp-content/uploads/2024/07/MVPF_Climate_Policy.pdf,,"The Environment: Harm to human health, biodiversity, risks and climate change",,Working paper/mimeo; not published in a peer-reviewed journal,,,
The Impact of PhD Studies on Mental Health—A Longitudinal Population Study,,https://lucris.lub.lu.se/ws/portalfiles/portal/194583123/WP24_5,,"Innovation, meta-science, and research",,"Working paper/mimeo, not published",,,
Unconditional Cash Transfers: A Bayesian Meta-Analysis of Randomized Evaluations in Low and Middle Income Countries,02_final consideration needed,,,Economic development & governance (LMICs),,,,,
Forest Protection and Human Health: The Case of Malaria in the Brazilian Amazon,,https://ideas.repec.org/p/spa/wpaper/2023wpecon8.html,,"GH&D,'Health-Related' Outcomes and Interventions in LMIC",,"Working paper/mimeo, not published",,Also falls into Env Econ,
Unconditional Cash Transfers: A Bayesian Meta-Analysis of Randomized Evaluations in Low and Middle Income Countries,,https://www.nber.org/papers/w32779,https://doi.org/10.3386/w32779,Economic development & governance (LMICs),,"Working paper/mimeo, not published",,Welfare,
Intergenerational Discounting and Inequality,deprioritized -- out of scope or other subjective judgment,https://www.researchgate.net/publication/381520539_Intergenerational_Discounting_and_Inequality,doi.org/10.13140/RG.2.2.18112.14080,"The Environment: Harm to human health, biodiversity, risks and climate change","Other (Economics): Welfare, growth, policy, global markets & popn.",Working paper/mimeo; not published in a peer-reviewed journal,,Environment/Environment and Resource economics,
"Therapy, Mental Health, and Human Capital Accumulation among Adolescents in Uganda",02_final consideration needed,https://documents1.worldbank.org/curated/en/099552207102441963/pdf/IDU1007db5cd16b2f146811a516124d1708f3085.pdf,,Economic development & governance (LMICs),Global health; “Health & well-being in low-income countries”,Working paper/mimeo; not published in a peer-reviewed journal,2024-07-01T00:00:00.000-04:00,,
Interventions that influence animal-product consumption: A meta-review ,01_Needs prioritization/assessor rating,https://www.sciencedirect.com/science/article/pii/S2666833521000976,,"Attitudes and behaviors (Altruism, moral circles, animal consumption, effectiveness, political attitudes, etc.) [Psychology/behavioral economics adjacent group]",Markets for products with large externalities (focus: animal agriculture),"Published, ? journal",,,internal-NBER
Deadweight Losses or Gains from In-kind Transfers? Experimental Evidence from India,02_final consideration needed,https://monash-econ-wps.s3.amazonaws.com/RePEc/mos/moswps/2022-10.pdf,,Development Economics,,Working paper/mimeo; not published in a peer-reviewed journal,,Cash transfers,
"Delegation Risk and Implementation at Scale:
Evidence from a Migration Loan Program in Bangladesh",01_Needs prioritization/assessor rating,https://ashishenoy.github.io/Website/Paper_NLS_Evaluation.pdf,,Economic development & governance (LMICs),,Working paper/mimeo; not published in a peer-reviewed journal,2024-05-15T00:00:00.000-04:00,Development/Development Economics,
"Machine learning predicts which rivers, streams, and wetlands the Clean Water Act regulates","de-prioritized bc. of journal-publication status, authors permission, etc.",https://www.ncbi.nlm.nih.gov/pmc/articles/PMC11008676/,https://doi.org/10.1126/science.adi3794,"The Environment: Harm to human health, biodiversity, risks and climate change",,"Published, ~top journal",2024-01-25T00:00:00.000-05:00,"Environmental science,Environment/Environment and Resource economics",
The Macroeconomic Impact of Climate Change: Global vs. Local Temperature ,10_seeking_(more)_evaluators,https://dkaenzig.github.io/diegokaenzig.com/Papers/bk_micc.pdf,,"The Environment: Harm to human health, biodiversity, risks and climate change",,Working paper/mimeo; not published in a peer-reviewed journal,2024-08-01T00:00:00.000-04:00,,
The global potential for natural regeneration in deforested tropical regions,01_Needs prioritization/assessor rating,https://www.researchsquare.com/article/rs-3235955/v1,https://doi.org/10.21203/rs.3.rs-3235955/v1,"The Environment: Harm to human health, biodiversity, risks and climate change",,Working paper/mimeo; not published in a peer-reviewed journal,,,
China and the U.S. produce more impactful AI research when collaborating together,01_Needs prioritization/assessor rating,https://arxiv.org/abs/2304.11123,https://doi.org/10.48550/arXiv.2304.11123,Emerging technologies: social and economic impacts (focus: AI),,Working paper/mimeo; not published in a peer-reviewed journal,2023-04-21T00:00:00.000-04:00,,
Adjusting for Scale-Use Heterogeneity in Self-Reported Well-Being,02_final consideration needed,https://www.nber.org/papers/w31728,doi.org/10.3386/w31728,"Health and well-being (global, including wealthy countries)","Other (Economics): Welfare, growth, policy, global markets & popn.",Working paper/mimeo; not published in a peer-reviewed journal,2023-12-01T00:00:00.000-05:00,well-being,
Asymmetry in Civic Information: An Experiment on Tax Participation among Informal Firms in Togo,02_final consideration needed,https://novafrica.org/wp-content/uploads/2021/11/2021.12.10_Moussa-Blimpo.pdf,https://novafrica.org/wp-content/uploads/2021/11/2021.12.10_Moussa-Blimpo.pdf,Economic development & governance (LMICs),,Unpublished,2021-10-01T00:00:00.000-04:00,"causal inference,Development/Development Economics,Economics of Information,Firm Behavior,Taxation",
The Effect of Public Science on Corporate R&D,04_selected_choose_evaluation_manager,https://www.nber.org/papers/w31899,doig.org/10.3386/w31899,"Innovation, meta-science, and research",,Working paper/mimeo; not published in a peer-reviewed journal,2023-11-01T00:00:00.000-04:00,Innovation and R&D,
"Social Safety Nets, Women’s Economic
Achievements and Agency",02_final consideration needed,https://www.cgdev.org/sites/default/files/social-safety-nets-womens-economic-achievements-and-agency-systematic-review-and-meta.pdf,,Economic development & governance (LMICs),,Working paper/mimeo; not published in a peer-reviewed journal,2024-03-05T00:00:00.000-05:00,"Poverty and Wellbeing,cash grants,Development/Development Economics",
Resilience Reconsidered: The need for modelling resilience in food distribution and trade relations in post-nuclear war recovery,01_Needs prioritization/assessor rating,https://www.researchgate.net/publication/378825936_Resilience_Reconsidered_The_need_for_modelling_resilience_in_food_distribution_and_trade_relations_in_post-nuclear_war_recovery/link/65f413561f0aec67e29005dc/download?_tp=eyJjb250ZXh0Ijp7ImZpcnN0UGFnZSI6InB1YmxpY2F0aW9uRGlyZWN0b3J5IiwicGFnZSI6InB1YmxpY2F0aW9uIn19,10.13140/RG.2.2.10760.23043/1,"Catastrophic and existential risks,  the long-term future, forecasting",,Working paper/mimeo; not published in a peer-reviewed journal,,"Environment/Environment and Resource economics,Globalization and International Relations/Global policy,Food Systems/Food Security,Policymaker decision-making,International trade and welfare,Environmental science",
Partisan Disparities in the Use of Science in Policy,02_final consideration needed,https://www.ipr.northwestern.edu/our-work/working-papers/2024/wp-24-05.html,,"Innovation, meta-science, and research",,Working paper/mimeo; not published in a peer-reviewed journal,2024-01-29T00:00:00.000-05:00,the economics of science and innovation,
Quantifying the Benefit of Artificial Intelligence for Scientific Research,02_final consideration needed,https://arxiv.org/abs/2304.10578,https://doi.org/10.48550/arXiv.2304.10578,Emerging technologies: social and economic impacts (focus: AI),"Catastrophic & existential risks, the long-term future, forecasting",Working paper/mimeo; not published in a peer-reviewed journal,2023-04-17T00:00:00.000-04:00,Innovation and R&D,
When Product Markets Become Collective Traps: The Case of Social Media,02_final consideration needed,https://bfi.uchicago.edu/wp-content/uploads/2023/10/BFI_WP_2023-131.pdf,10.3386/w31771,"Other: Economics/welfare, growth, policy, global markets and population",,Working paper/mimeo; not published in a peer-reviewed journal,2023-10-01T00:00:00.000-04:00,"Welfare and collective choice,consumer preferences",
The role of autonomous experimentation in biomedical sciences and health innovation: Challenges and opportunities in emerging economies,,https://papers.ssrn.com/sol3/papers.cfm?abstract_id=4672439,"GonçalvesLeoneldaSilva,Renan,Theroleofautonomousexperimentationinbiomedicalsciencesandhealthinnovation:Challengesandopportunitiesinemergingeconomies(January3,2024).AvailableatSSRN:https://ssrn.com/abstract=4672439orhttp://dx.doi.org/10.2139/ssrn.4672439",Emerging technologies: social and economic impacts (focus: AI),Economic development & governance (LMICs),Working paper/mimeo; not published in a peer-reviewed journal,2024-01-07T00:00:00.000-05:00,Innovation and R&D,
Willful Ignorance and Moral Behavior,"50_published evaluations (on PubPub, by Unjournal)",https://papers.ssrn.com/sol3/papers.cfm?abstract_id=3938994,,Markets for products with large externalities (focus: animal agriculture),Markets for products with large externalities (focus: animal agriculture),Working paper/mimeo; not published in a peer-reviewed journal,,animal welfare,
Welfare costs of catastrophes: lost consumption and lost lives,01_Needs prioritization/assessor rating,https://mitsloan.mit.edu/shared/ods/documents?PublicationDocumentID=7763,,"Catastrophic and existential risks,  the long-term future, forecasting","Other (Economics): Welfare, growth, policy, global markets & popn.","Published, ~top journal",,,internal-from-syllabus-agenda-policy-database
Meta-Analysis and Public Policy: Reconciling the Evidence on Deworming,"de-prioritized bc. of journal-publication status, authors permission, etc.",https://scholar.harvard.edu/files/kcroke/files/nber_deworming_2022.pdf,,Global health; “Health & well-being in low-income countries”,Economic development & governance (LMICs),Working paper/mimeo; not published in a peer-reviewed journal,,Health Policy/Health economics,suggested - externally - NGO
Legalizing Entrepreneurship,"50_published evaluations (on PubPub, by Unjournal)",https://www.nber.org/papers/w30624,,Economic development & governance (LMICs),"Other (Economics): Welfare, growth, policy, global markets & popn.",Working paper/mimeo; not published in a peer-reviewed journal,2022-11-01T00:00:00.000-04:00,"Development/Development Economics,Labor Economics,Labor Supply and Demand,Other,Law and Economics,Industrial Organization,Firm Behavior,Migration",internal-NBER
Challenges in Constructing a Survey-Based Well-Being Index,deprioritized -- low ratings,https://www.nber.org/papers/w23111,,Empirical methods,Economic development & governance (LMICs),"Published, ~top journal",,"Econometrics,Data Collection,Microeconomics,Health, Education, and Welfare,Poverty and Wellbeing",suggested - internally
"Utilitarianism for animals, Kantianism for people.  Harming Animals and Humans for the Greater Good.",deprioritized -- low ratings,http://files.luciuscaviola.com/Caviola-et-al_2020_JEPG.pdf,,"Attitudes and behaviors (Altruism, moral circles, animal consumption, effectiveness, political attitudes, etc.) [Psychology/behavioral economics adjacent group]",Markets for products with large externalities (focus: animal agriculture),"published, decent journal ",,,suggested - externally
Does Conservation Work in General Equilibrium?,"50_published evaluations (on PubPub, by Unjournal)",https://www.dropbox.com/scl/fi/0uv69awcp37tkaozdlmm7/ConservationGeneralEquilibrium_SalazarRestrepo_LeiteMariante_20240312.pdf?rlkey=9e2nx6h50xbaiji94tattvpsn&dl=0,,"Other: Economics/welfare, growth, policy, global markets and population","The Environment: Harm to human health, biodiversity, risks & climate,Markets for products with large externalities (focus: animal agriculture)",Working paper/mimeo; not published in a peer-reviewed journal,2023-12-08T00:00:00.000-05:00,Environment/Environment and Resource economics,
Averting Catastrophes that Kill,"de-prioritized bc. of journal-publication status, authors permission, etc.",https://www.nber.org/system/files/working_papers/w23346/w23346.pdf,,"Other: Theory and philosophy, artificial intelligence, natural science, etc.",,Working paper/mimeo; not published in a peer-reviewed journal,,"Microeconomics,Economics of Information,Public Economics,National Fiscal Issues,Environment/Environment and Resource economics",internal-NBER
When Celebrities Speak: A Nationwide Twitter Experiment Promoting Vaccination In Indonesia,"50_published evaluations (on PubPub, by Unjournal)",https://web.stanford.edu/~arungc/ACMOP.pdf,,Global health; “Health & well-being in low-income countries”,"Communicable diseases, bio-security & pandemic preparedness, biological risks",Working paper/mimeo; not published in a peer-reviewed journal,2019-02-25T00:00:00.000-05:00,"Microeconomics,Economics of Information,Health, Education, and Welfare,Development and Growth,Innovation and R&D,Health Policy/Health economics",internal-NBER
Rationalizing risk aversion in science,01_Needs prioritization/assessor rating,https://arxiv.org/abs/2306.13816,https://doi.org/10.48550/arXiv.2306.13816,"Innovation, meta-science, and research","Other (Economics): Welfare, growth, policy, global markets & popn.","Published, ~top journal",2023-06-23T00:00:00.000-04:00,"Metascience,the economics of science and innovation",suggested - internally
Is Power-Seeking AI an Existential Risk?,deprioritized -- low ratings,https://arxiv.org/abs/2206.13353,,"Catastrophic and existential risks,  the long-term future, forecasting",,Working paper/mimeo; not published in a peer-reviewed journal,,,suggested - externally - NGO
Mental health improves on sunnier days of the year.,deprioritized -- low ratings,https://osf.io/bj4kr/,,"Health and well-being (global, including wealthy countries)",Possible category: more ‘economics’ treatment of preferences for giving and ‘ethical/donation-linked’ choices; implications of these preferences; donor coordination etc.,Working paper/mimeo; not published in a peer-reviewed journal,,,submitted (by author(s))
Economic vs. Epidemiological Approaches to Measuring the Human Capital Impacts of Infectious Disease Elimination,"50_published evaluations (on PubPub, by Unjournal)",https://www.nber.org/papers/w30202,,Global health; “Health & well-being in low-income countries”,Economic development & governance (LMICs),Working paper/mimeo; not published in a peer-reviewed journal,2022-07-01T00:00:00.000-04:00,Health Policy/Health economics,
The AI dilemma: Growth versus existential risk,deprioritized -- low ratings,https://www.nber.org/papers/w31837,,"Catastrophic and existential risks,  the long-term future, forecasting","Other (Economics): Welfare, growth, policy, global markets & popn.",Working paper/mimeo; not published in a peer-reviewed journal,,,suggested - internally
No Great Equalizer: Experimental Evidence on AI in the UK Labor Market,deprioritized -- low ratings,https://papers.ssrn.com/sol3/papers.cfm?abstract_id=4594466,http://dx.doi.org/10.2139/ssrn.4594466,Emerging technologies: social and economic impacts (focus: AI),,Working paper/mimeo; not published in a peer-reviewed journal,2023-11-02T00:00:00.000-04:00,Labor Economics,
Money (Not) to Burn: Payments for Ecosystem Services to Reduce Crop Residue Burning,"50_published evaluations (on PubPub, by Unjournal)",https://seemajayachandran.com/money_not_to_burn.pdf,,Economic development & governance (LMICs),"The Environment: Harm to human health, biodiversity, risks & climate",Working paper/mimeo; not published in a peer-reviewed journal,2022-08-11T00:00:00.000-04:00,"Health, Education, and Welfare",suggested - externally - NGO
Selecting the Most Effective Nudge: Evidence from a Large-Scale Experiment on Immunization,"50_published evaluations (on PubPub, by Unjournal)",https://arxiv.org/abs/2104.09645v2,,Global health; “Health & well-being in low-income countries”,,Published - CHECK,,"Global Health/ interventions,Policy",suggested - externally - NGO
A systematic review and meta-analysis of the impact of cash transfers on subjective well-being and mental health in low- and middle-income countries`,01_Needs prioritization/assessor rating,https://www.nature.com/articles/s41562-021-01252-z,,Global health; “Health & well-being in low-income countries”,Economic development & governance (LMICs),"published, decent journal ",,,
The Past and Future of Economic Growth: A Semi-Endogenous Perspective,01_Needs prioritization/assessor rating,https://www.nber.org/papers/w29126,,"Other: Economics/welfare, growth, policy, global markets and population",,"published, decent journal ",,"Development and Growth,Policy",internal-NBER
How Will Hen Welfare Be Impacted by the Transition to Cage-Free Housing?,deprioritized -- low ratings,https://www.openphilanthropy.org/research/how-will-hen-welfare-be-impacted-by-the-transition-to-cage-free-housing/,,Markets for products with large externalities (focus: animal agriculture),,Published - CHECK,,animal welfare,suggested - externally - NGO
"The Long-Run Effects of Psychotherapy on Depression, Beliefs, and Economic Outcomes","50_published evaluations (on PubPub, by Unjournal)",https://jondequidt.com/pdfs/psychotherapy-depression.pdf,,Global health; “Health & well-being in low-income countries”,"Health & well-being (global, incl. wealthy countries) ,Attitudes & behaviors (Altruism, moral circles,  effectiveness, political, etc.) [Psych/BE-adjacent ],Economic development & governance (LMICs)",Working paper/mimeo; not published in a peer-reviewed journal,2023-01-31T00:00:00.000-05:00,"Mental Health Interventions,Global Health/ interventions",suggested - externally - NGO
Monetary incentives increase COVID-19 vaccinations,01_Needs prioritization/assessor rating,https://www.science.org/doi/10.1126/science.abm0475?cookieSet=1,,"Communicable diseases, bio-security and pandemic preparedness, biological risks","Other (Economics): Welfare, growth, policy, global markets & popn.","Published, ~top journal",,Health Policy/Health economics,submitted (by author(s))
How Much Would Reducing Lead Exposure Improve Children’s Learning in the Developing World?,"50_published evaluations (on PubPub, by Unjournal)",https://www.cgdev.org/sites/default/files/how-much-would-reducing-lead-exposure-improve-childrens-learning-developing-world.pdf,,Global health; “Health & well-being in low-income countries”,,Working paper/mimeo; not published in a peer-reviewed journal,2023-07-01T00:00:00.000-04:00,"Health, Education, and Welfare",suggested - externally
The Psychology of Existential Risk: Moral Judgments about Human Extinction,01_Needs prioritization/assessor rating,https://www.nature.com/articles/s41598-019-50145-9,,"Attitudes and behaviors (Altruism, moral circles, animal consumption, effectiveness, political attitudes, etc.) [Psychology/behavioral economics adjacent group]",,"published, decent journal ",,,internal-from-syllabus-agenda-policy-database
Seeking Evidence: Which Studies Do Policymakers Prefer?,authors rejected/blocked us,,,"Other: Economics/welfare, growth, policy, global markets and population",,,,"Global Health/ interventions,Policymaker decision-making,expert beliefs, prediction markets, etc.",suggested - internally
Bardhan’s Targeting the Hard Core Poor Program: A qualitative study on participants’ ascent out of extreme poverty,deprioritized -- low ratings,https://www.findevgateway.org/sites/default/files/publications/files/bandhan-thp-_a_qualitative_study_on_participants_ascent_out_of_extreme_poverty_.pdf,,Economic development & governance (LMICs),,,,,suggested - internally
The end of economic growth? Unintended consequences of a declining population,01_Needs prioritization/assessor rating,https://www.nber.org/papers/w26651,,"Other: Economics/welfare, growth, policy, global markets and population",,"Published, ~top journal",,"Development and Growth,Policy",internal-NBER
Should Aid Reward Performance? Evidence from a Field Experiment on Health and Education in Indonesia,01_Needs prioritization/assessor rating,https://citeseerx.ist.psu.edu/document?repid=rep1&type=pdf&doi=d8c3c3552bb19ba8c2c667e3d795fdfd940f0e8f,,Economic development & governance (LMICs),Global health; “Health & well-being in low-income countries”,"Published, ~top journal",,,suggested - externally
Frontier AI Regulation,deprioritized -- low ratings,https://arxiv.org/abs/2307.03718,https://doi.org/10.48550/arXiv.2307.03718,Emerging technologies: social and economic impacts (focus: AI),,Working paper/mimeo; not published in a peer-reviewed journal,2023-11-07T00:00:00.000-05:00,AI Alignment,
Artificial Intelligence and Economic Growth,"50_published evaluations (on PubPub, by Unjournal)",https://www.nber.org/papers/w23928,,Emerging technologies: social and economic impacts (focus: AI),"Other (Economics): Welfare, growth, policy, global markets & popn.","Published, uncertain peer review",2017-10-01T00:00:00.000-04:00,"Development and Growth,Innovation and R&D,Policy",internal-from-syllabus-agenda-policy-database
Quadratic Funding with Incomplete Information,deprioritized -- low ratings,https://globalprioritiesinstitute.org/wp-content/uploads/Luis-V.-M.-Freitas-Wilfredo-L.-Maldonado-Quadratic-Funding-with-Incomplete-Information.pdf,,"Other: Economics/welfare, growth, policy, global markets and population",,Working paper/mimeo; not published in a peer-reviewed journal,,,suggested - internally
The Impact of Artificial Intelligence on Innovation,deprioritized -- low ratings,nber.org/papers/w24449,,Emerging technologies: social and economic impacts (focus: AI),"Innovation, meta-science, & research",book chapter,,"Industrial Organization,Market Structure and Firm Performance",internal-NBER
Saving for a lean Season,authors rejected/blocked us,https://www.dropbox.com/s/u3zah3pxm9vtnm0/Saving%20for%20a%20lean%20Season.pdf?dl=0,,Economic development & governance (LMICs),Global health; “Health & well-being in low-income countries”,Working paper/mimeo; not published in a peer-reviewed journal,,,submitted (by author(s))
AI-tocracy,02_final consideration needed,https://core.ac.uk/download/511315653.pdf,,Emerging technologies: social and economic impacts (focus: AI),"International cooperation & conflict, government behavior,  authoritarianism","Published, ~top journal",,"Industrial Organization,Development and Growth,Innovation and R&D,Economic Systems,Policy",internal-NBER
